title,body
"Did you know? Colby Covington has a charity that helps veterans and their families, allowing them to live a better life. Way to go Colby! Protecting those vets!",https://www.reddit.com/gallery/1hhbkz3
What was your fight of the year?,https://i.redd.it/816dtonk7o7e1.jpeg
This will be a game changer for combat sports if it works as intended. ,https://i.redd.it/8f3mue7j4o7e1.jpeg
Jon lost his bag!,https://i.redd.it/urii6p33kn6e1.jpeg
"if Ilia actually does challenge this guy after Arman, that means 3 of his 5 Lightweight title defenses would be against Featherweights",https://i.redd.it/cyh260kion7e1.png
How would Shamil Musaev do in the UFC?,https://i.redd.it/lvb8pfkken7e1.jpeg
UFC Tampa ,https://www.reddit.com/gallery/1hh7m1k
UFC Tampa ,https://www.reddit.com/gallery/1hh7lzc
Stay safe everyone.,https://v.redd.it/dk3jzsctan7e1
"Before Nov 2024, there was never a fight (in any org!) where BOTH fighters had a) No losses and b) 15+ wins. Since then, it's happened TWICE! (PFL: Musaev vs Umalatov + Rakhmonov vs Ian Garry in UFC)",https://i.redd.it/p2zl9zh98n7e1.png
Last thing i expected was Colby to land (at least partially) a spinning head kick. Set up was whack though.,https://v.redd.it/hd5endg08n7e1
Tony Ferguson fan fighting Nate Diaz fan,https://v.redd.it/7km9kj5wlj7e1
We need Kape vs Kai Kara ASAP!,https://v.redd.it/vnh7gv5yvm7e1
It was amazing year of being fan on Poatan. So many amazing moments I will NEVER forget.,https://i.redd.it/gpxdd0yavm7e1.jpeg
"Can't wait for AI judging to be used in the UFC. No more of these corrupt or stupid decisions ruining people's careers (i.e. Volkov, Reyes, Leal, Hamill, Jared etc.)",https://themaclife.com/featured-posts/usyk-fury-ii-to-feature-ai-judge/
its going down for reaal,https://www.reddit.com/gallery/1hh4gi3
What is your definitive dream fight? I'll go first with prime Gustafsson vs Poatan.,https://www.reddit.com/gallery/1hh474r
Buckley had a great 2024 🫡,https://v.redd.it/mgpqrb9zlm7e1
UFC 2024 (Vote 5 - Submission of the Year),https://i.redd.it/toghxkf3km7e1.jpeg
Most Russians ,https://v.redd.it/yomhxtmhfm7e1
"Jon Jones & Chandler Jones, siblings who dominate in their respective field 💪",https://i.redd.it/7h9wo61cdm7e1.jpeg
Guys can we officially start calling him McChicken from now on? Like who's McGregor? We only know Conor McChicken.,https://i.redd.it/qzs6ce458m7e1.jpeg
A Charles Oliver Youngboy Edit Is Outrageous. ,https://v.redd.it/9s0qx6zx3m7e1
What was the robbery of the year?,https://i.redd.it/lzpe93wb2m7e1.jpeg
Who would win this hypothetical matchup? ,https://www.reddit.com/gallery/1hh1m80
Going through Pantoja's wikipedia page hit me hard. He later explained saying his alcoholic dad abandoned his family for a rich woman and his mother's BF was also an alcoholic and a druggy,https://i.redd.it/43aw215uvl7e1.png
Seriously! Is there a way to defeat dagestani fighters ???!!!,https://i.redd.it/uv5brf75pl7e1.png
Who wins in a ground battle?,https://www.reddit.com/gallery/1hgzrhf
Which UFC fighters are they?,https://i.redd.it/fvjub752el7e1.jpeg
Champs 2023 ➡️ 2024,https://www.reddit.com/gallery/1hgyatz
"Islam regarding ilia ""we will fight if he wants to"" ",https://www.instagram.com/p/DDIDDPhRLpy/?img_index=1&igsh=cDRvcjFuZnJpYzUw
Tony the type of guy to save Chernobyl in his phone gallery and then post it in Khabibs dms to defeat him once more. -CSO-😎,https://i.redd.it/682uo0n6sk7e1.jpeg
"It was a phenomenal year for Mma fans , we ate good chat.",https://v.redd.it/a3baiqjsbk7e1
Calling anyone out,https://v.redd.it/a8z11x4l8k7e1
ufc website is down? or just me?,https://i.redd.it/jqnrb6fo6k7e1.jpeg
"In my opinion Yair is the worst match for topuria on the feet : reach,kicks ,fast with solid chin. Too bad he has no tdd . ",https://i.redd.it/quxmojgrpj7e1.jpeg
Chael responding to fans after Gilbert Burns leaked his number ,https://v.redd.it/9cshr4k5nj7e1
Chael posts a video of himself answering calls after Gilbert Burns leaked his number and it's hilarious ,https://www.youtube.com/watch?v=AiA9Jft2Fv4&t=620s
Lmfao DC has 0 chill,https://v.redd.it/4blkols2ij7e1
Donald has a new favourite fighter! What's next for Colby?,https://www.reddit.com/gallery/1hgu98i
I love Reddit !!!!,https://i.redd.it/9vwc15ppgj7e1.jpeg
Take a pick,https://i.redd.it/677ezhqlcj7e1.jpeg
Can we finally give up on McGregor Now? ,https://i.redd.it/a5dvdbbgcj7e1.png
I feel like Conor takes this easily,https://www.reddit.com/gallery/1hgtuh5
Rewatched this fight and deadass shed a tear,https://i.redd.it/1d41nxdf0j7e1.jpeg
Topuria on “Mchicken” fight rumors 😂😂😭😭,https://i.redd.it/a7hscy800j7e1.jpeg
How the hell is Shavkat supposed to beat Belal? After last fight it’s pretty obvious if he can’t clinchfest throwing no punches he can get outstruck and he’s not taking Belal down at all. ,https://i.redd.it/18j0bzjyti7e1.jpeg
Inject this into my veins for 5 round co main international fight week. ,https://i.redd.it/c1keg7r3si7e1.jpeg
"When Khabib talks about legacy, this is what he means. You can see he is genuinely offended by DJ not having all of his belts. ",https://v.redd.it/mnnkhwwzji7e1
Bryce Mitchell can spit some HEAT 🔥🔥,https://youtu.be/wWU0QejFMqA
How do you think he will do in the UFC?,https://i.redd.it/79f2u0tngi7e1.jpeg
Pantoja is an Uber driver on the side 💪,https://i.redd.it/0kmgdxf2fi7e1.jpeg
Conor McGregor’s : ‘God willing!’,https://i.redd.it/s97w0ib3ei7e1.jpeg
Chael is Johnny Cage confirmed? ,https://www.reddit.com/gallery/1hgpcif
What do we think about mma joey ,https://i.redd.it/6ersdunezh7e1.jpeg
"Khabib - "" Now Islam will train with Demetrious Johnson""   Islam - ""Bhatha ... thank you"" ",https://i.redd.it/fjvcv7rvxh7e1.png
@10:25 Hot Fire ,https://i.redd.it/v8qr3qczvh7e1.png
This fight made me realize Khamzat was going to be champion in whatever division he chooses. The way he boa constrictor wrapped up Holland with the speed he did it is something I’ve never seen in grappling or mma.,https://i.redd.it/r3i7cizdsh7e1.jpeg
"Look,I’ve never had to chase pussy in my life on December 30th.I ain’t doing it.I don’t have to!",https://i.redd.it/0owgwbsqph7e1.jpeg
Throwback to Cowboys crazy activity 12 fights in 3 years ,https://i.redd.it/ugs6lio8oh7e1.jpeg
Early predictions for this one?,https://i.redd.it/p19t7dpkmh7e1.jpeg
"should jiri move to middleweight/heavyweight? if so, who would you want to see him fight?",https://i.redd.it/pfq6ruwbmh7e1.jpeg
It's a UFC Christmas 🌲🎅🏽 (Scroll),https://www.reddit.com/gallery/1hgmxtg
Michael Johnson Killed That Man!,https://v.redd.it/nyw6kbtiih7e1
"This video is funny asf, ""Kevin Holland Responds to Voicemails on the Big Mouth Hotline""",https://v.redd.it/or594busfh7e1
Could McGregor at FW have defeated Alex Volkanovski?,https://i.redd.it/h3tnwnq5eh7e1.jpeg
Colby’s corner threw the towel in?,https://i.redd.it/73fykg7kbh7e1.jpeg
"If prime Jon Jones and prime DC were locked in a room with no refs, no rounds, and only one comes out alive… who’s walking out, and who’s blaming the eye pokes ?",https://i.redd.it/vckb9kf27h7e1.jpeg
UFC broadcast caught a kid choking in the crowd while his dad watched the KO replay. ,https://v.redd.it/smxt98xz5h7e1
How does one obtain the Martin Buday physique? 🤔,https://i.redd.it/t2159kzr4h7e1.png
Which potential match-up could enter the list of most PPV buys? Aspinall-Jones? ,https://i.redd.it/35xxrkxd3h7e1.jpeg
Javier Mendez confirms that Islam Makhachev was sick in his first fight against Arman Tsarukyan,https://v.redd.it/47u5gfkaxg7e1
Broo Buppperd!!!!,https://v.redd.it/zkpsm1urwg7e1
These Islams fans glazing is getting out of hand ,https://www.reddit.com/gallery/1hgjlf5
Why so much hate towards ilia topuria?,https://i.redd.it/b88l0flutg7e1.jpeg
We in this together brother. Support.,https://i.redd.it/kmyxah7tqg7e1.png
"Hypothetical - If he had a six-month training camp and didn't split his eye open in the first round, would this man have had a realistic chance against Joaquin Buckley?",https://i.redd.it/ru2gkm4jmg7e1.png
Islam is funny yet strange dude. ,https://streamable.com/lvqc1s
Kron Gracie tests positive after UFC310,https://i.redd.it/t89gcd8olg7e1.jpeg
Colby’s snapchat story is an interesting place…,https://i.redd.it/paorrby99g7e1.jpeg
Can't believe that the UFC is hiding this from both of their records.,https://i.redd.it/tmx6tjpc6g7e1.png
Islam asks DC to come join his camp to try and control Khabib 🤣,https://v.redd.it/h7klrh455g7e1
Bonfim after that cash ,https://i.redd.it/lsf6ll1y3g7e1.png
Agreed.,https://i.redd.it/mjajq0xo1g7e1.jpeg
Crazy how tight these two are,https://i.redd.it/4v264lkzyf7e1.jpeg
"Islam's performance is such a coin toss based on his conditioning, he'll either struggle with Arman for 5 rounds or flash finish him like nothing",https://i.redd.it/1ojg3oywxf7e1.png
This guy should just retire,https://i.redd.it/4fcayxj7tf7e1.jpeg
UFC 2024 (Vote 4 - Most successful gym of 2024),https://i.redd.it/qc8bi1ftqf7e1.jpeg
"Scripted fights that earn millions while fooling fans — after Mike Tyson, will people still watch Jake Paul's scripted events?",https://i.redd.it/fja2zhadqf7e1.png
Debating with a friend whether or not Topuria had the greatest back to back wins in UFC history ,https://i.redd.it/w9clfklkkf7e1.jpeg
That’s a violation right there 😭,https://v.redd.it/f8alxllyjf7e1
"If you could make one fighter champ, who would it be?",https://i.redd.it/jd0m7b4ejf7e1.jpeg
So connor is gonna make $20M out of this. How much would his UFC Return Made at 303???,https://i.redd.it/15kfovacif7e1.jpeg
"My grandkids will be told the tale of ""El Cucuy"".",https://v.redd.it/ngolh1bzhf7e1
Which of these fighters would you impregnate?,https://www.reddit.com/gallery/1hgcipu
Guy sounded so defeated the entire interview ,https://i.redd.it/dig8hndlbf7e1.jpeg
Multiverse of Madness,https://i.redd.it/6y3vn8pmaf7e1.jpeg
I have to respect this level of dedication to nonsense lol,https://v.redd.it/82qy49ou5f7e1
Prime Jackie Chan vs Islam. Who win in MMA fight?,https://i.redd.it/wln24s0t2f7e1.jpeg
"The Realest, Greatest and Definitive GOAT list (Not my opinion only Facts)",https://i.redd.it/tsqb6m402f7e1.jpeg
